{
  "$schema": "https://json-schema.org/draft/2020-12/schema",
  "$id": "https://floridahomecosts.com/data/permits/_schema.json",
  "title": "Florida County Permit Fee Data",
  "description": "Authoritative permit fee + Florida-specific context data, per county. v1.2.",
  "type": "object",
  "required": [
    "county", "display_name", "state", "metro_areas", "hvhz",
    "design_wind_speed_mph", "data_source_url", "last_verified",
    "schema_version", "permits"
  ],
  "properties": {
    "county": {
      "type": "string",
      "pattern": "^[a-z][a-z0-9-]*$",
      "description": "Slug form of the county name. Lowercase, hyphenated. Must match the filename stem."
    },
    "display_name": {
      "type": "string",
      "description": "Human-readable county name as it appears in articles (e.g., 'Miami-Dade County')."
    },
    "state": {
      "type": "string",
      "const": "FL",
      "description": "Two-letter state code. All counties in this dataset are FL."
    },
    "metro_areas": {
      "type": "array",
      "items": {"type": "string"},
      "minItems": 1,
      "description": "Cities, towns, and CDPs within the county. Used by content templates to match an article's location to a county."
    },
    "hvhz": {
      "type": "boolean",
      "description": "True if the county is in the High Velocity Hurricane Zone per FBC. Only Miami-Dade and Broward qualify as of FBC 8th Edition (2023)."
    },
    "design_wind_speed_mph": {
      "type": "object",
      "required": ["risk_category_ii"],
      "additionalProperties": false,
      "properties": {
        "risk_category_ii": {"type": "integer", "minimum": 100, "maximum": 250},
        "risk_category_iii": {"type": "integer", "minimum": 100, "maximum": 250},
        "risk_category_iv": {"type": "integer", "minimum": 100, "maximum": 250}
      },
      "description": "Ultimate design wind speeds (mph) per ASCE 7-22 / FBC 8th Edition. Cat II = single-family homes; Cat III = schools/hospitals; Cat IV = essential facilities."
    },
    "data_source_url": {
      "type": "string",
      "format": "uri",
      "description": "Primary source URL for the county fee schedule. Must be publicly accessible."
    },
    "data_source_document": {
      "type": "string",
      "description": "Optional identifier for the specific source document (e.g., 'Implementing Order 4-63 effective 2025-06-30')."
    },
    "last_verified": {
      "type": "string",
      "format": "date",
      "description": "ISO 8601 date the source document was last reviewed (YYYY-MM-DD). Should be refreshed at least quarterly OR whenever source URL is re-checked. Stale dates (>180 days) indicate the data should be re-verified before being cited."
    },
    "schema_version": {
      "type": "string",
      "pattern": "^[0-9]+\\.[0-9]+$",
      "description": "Schema version this file conforms to. Bump when breaking changes are introduced."
    },
    "permits": {
      "type": "object",
      "description": "Per-trade permit fee structures. Keys are trade-action identifiers (e.g., 'roofing_replace'). Counties include only the trades they collect at county level.",
      "minProperties": 1,
      "additionalProperties": {"$ref": "#/$defs/permit_fee"}
    },
    "operational_fees": {
      "type": "object",
      "description": "County-wide operational fees that apply across permits (inspection, overtime, permit extension, etc.). Optional.",
      "additionalProperties": false,
      "properties": {
        "minimum_permit_fee_usd": {"type": "number", "minimum": 0},
        "additional_inspection_fee_usd": {"type": "number", "minimum": 0},
        "overtime_inspection_per_hour_usd": {"type": "number", "minimum": 0},
        "holiday_inspection_per_hour_usd": {"type": "number", "minimum": 0},
        "holiday_inspection_minimum_hours": {"type": "integer", "minimum": 1},
        "permit_extension_fee_usd": {"type": "number", "minimum": 0},
        "lost_permit_card_fee_usd": {"type": "number", "minimum": 0},
        "lost_plans_minimum_sfr_usd": {"type": "number", "minimum": 0},
        "lost_plans_minimum_other_usd": {"type": "number", "minimum": 0},
        "double_fee_no_permit_pct": {"type": "number", "minimum": 0, "maximum": 1, "description": "Penalty multiplier for work done without permit (e.g., 1.0 = 100% additional, doubling the fee)"},
        "notes": {"type": "string"}
      }
    },
    "surcharges_and_fees": {
      "type": "object",
      "description": "Surcharges that apply on top of base permit fees. Decimal fractions (0.075 = 7.5%). State statutory surcharges (DBPR/BCAIF 1.5%, DCA 1.5%) apply countywide and may be listed.",
      "additionalProperties": true,
      "properties": {
        "county_surcharge_percentage": {"type": "number", "minimum": 0, "maximum": 1, "description": "County-specific surcharge applied to permit fees (e.g., Miami-Dade RER surcharge 7.5%)"},
        "dbpr_bcaif_surcharge_percentage": {"type": "number", "minimum": 0, "maximum": 1, "description": "Building Code Administrators and Inspectors Fund surcharge, statutory per FS 468.631. Statewide value is 1.5%."},
        "dca_surcharge_percentage": {"type": "number", "minimum": 0, "maximum": 1, "description": "FS 553.721 surcharge (administered by DBPR; agency formerly known as DCA). Statutory rate is 1.0% as of FS 553.721 (verified 2026-06-09 against 2025 Florida Statutes). Historical 1.5% rate was reduced circa 2017. Statutory minimum $2/permit; local government retains 10%."},
        "training_education_percentage": {"type": "number", "minimum": 0, "maximum": 1, "description": "Training and continuing education fee, where collected as percentage of permit fee."},
        "public_awareness_percentage": {"type": "number", "minimum": 0, "maximum": 1, "description": "Public awareness fee, where collected as percentage of permit fee."},
        "code_admin_fee_per_1000_value_usd": {"type": "number", "minimum": 0, "description": "Code administration fee per $1,000 of work value (e.g., Miami-Dade $0.60/$1,000)."},
        "radon_fee_per_sqft_usd": {"type": "number", "minimum": 0, "description": "State Radon fee, per square foot under roof (v1.2). Statutory rate per FS 553.71. PBC publishes this at $0.005/sqft; current statute should be verified for the rate value before any article cites a specific number — see project memory A1.5 queue for verification task."},
        "certification_maintenance_per_sqft_usd": {"type": "number", "minimum": 0, "description": "Certification Maintenance fee, per square foot under roof (v1.2). Statutory basis to be verified — see project memory A1.5 queue. PBC publishes this at $0.005/sqft."},
        "notes": {"type": "string"}
      }
    },
    "processing_time": {
      "type": "object",
      "description": "Typical permit processing time, in days. Optional — include only when the county publishes an estimate.",
      "additionalProperties": false,
      "properties": {
        "typical_days_min": {"type": "integer", "minimum": 1},
        "typical_days_max": {"type": "integer", "minimum": 1},
        "expedited_available": {"type": "boolean"},
        "expedited_days": {"type": "integer", "minimum": 1},
        "expedited_premium_usd": {"type": "number", "minimum": 0},
        "expedited_premium_per_hour_usd": {"type": "number", "minimum": 0},
        "notes": {"type": "string"}
      }
    },
    "labor_cost_premium": {
      "type": "object",
      "description": "Estimated labor cost premium for this county vs national average. Always an estimate — never authoritative.",
      "required": ["source_quality"],
      "properties": {
        "vs_national_average_percent_min": {"type": "number"},
        "vs_national_average_percent_max": {"type": "number"},
        "source_quality": {
          "type": "string",
          "enum": ["verified_official_data", "inferred_from_operational_consistency", "estimate_from_published_market_data", "estimate_from_anecdote"]
        },
        "sources": {"type": "array", "items": {"type": "string"}, "minItems": 1},
        "notes": {"type": "string"}
      }
    },
    "incorporated_city_notes": {
      "type": "object",
      "description": "Incorporated cities within the county that maintain their own fee schedules separate from the county. Key = city display name. Special key '_scope_note' (string) documents coverage limitations and is exempt from the per-city object schema.",
      "properties": {
        "_scope_note": {
          "type": "string",
          "description": "Free-text note about coverage limitations. Underscore-prefixed key bypasses the per-city object schema."
        }
      },
      "additionalProperties": {
        "type": "object",
        "required": ["uses_own_schedule"],
        "properties": {
          "uses_own_schedule": {"type": "boolean"},
          "source_url": {"type": "string", "format": "uri"},
          "notes": {"type": "string"}
        }
      }
    },
    "special_requirements": {
      "type": "object",
      "description": "County-specific or Florida-wide requirements that affect cost or scope.",
      "additionalProperties": {
        "type": "object",
        "additionalProperties": true
      }
    }
  },
  "$defs": {
    "permit_fee": {
      "type": "object",
      "required": ["type"],
      "properties": {
        "type": {
          "type": "string",
          "enum": [
            "flat",
            "flat_plus_surcharge",
            "percentage_of_value",
            "per_opening",
            "per_square_foot",
            "per_ton_flat",
            "per_amperage_unit",
            "per_kw",
            "per_1000_value",
            "tiered_by_value",
            "tiered_by_tonnage",
            "tiered_by_amperage"
          ]
        },
        "fee_usd": {"type": "number", "minimum": 0},
        "base_usd": {"type": "number", "minimum": 0},
        "rate": {"type": "number", "minimum": 0, "maximum": 1, "description": "Decimal fraction. 0.005 = 0.5%."},
        "minimum_usd": {"type": "number", "minimum": 0},
        "maximum_usd": {"type": "number", "minimum": 0},
        "maximum_usd_threshold": {"type": "number", "minimum": 0},
        "fee_usd_per_opening": {"type": "number", "minimum": 0},
        "fee_usd_per_sqft": {"type": "number", "minimum": 0, "description": "Per-square-foot rate, e.g. $0.96/sq ft Miami-Dade SFR new construction"},
        "fee_usd_per_ton": {"type": "number", "minimum": 0, "description": "Flat per-ton rate, e.g. $24.17/ton Miami-Dade HVAC"},
        "fee_usd_per_amp_unit": {"type": "number", "minimum": 0, "description": "Rate per amperage unit, e.g. $7.26 per 100 amp Miami-Dade service"},
        "amp_unit_size": {"type": "integer", "minimum": 1, "description": "Size of amperage unit (e.g., 100 for 'per 100 amp')"},
        "fee_usd_per_kw": {"type": "number", "minimum": 0, "description": "Per-kilowatt rate, e.g. $4.84/kw Miami-Dade heating equipment"},
        "fee_usd_per_1000_value": {"type": "number", "minimum": 0, "description": "Per $1,000 of estimated value, e.g. $7.03/$1,000 Miami-Dade unusual structures"},
        "tiers": {
          "type": "array",
          "minItems": 1,
          "items": {
            "type": "object",
            "properties": {
              "max_value_usd": {"type": ["number", "null"]},
              "max_tons": {"type": ["integer", "null"]},
              "max_amps": {"type": ["integer", "null"]},
              "fee_usd_per_100": {"type": "number", "minimum": 0, "description": "Per-$100-of-value rate for tiered_by_value (e.g. $2.82/$100 Miami-Dade Tier 1 commercial alterations)"},
              "fee_usd": {"type": "number", "minimum": 0},
              "per_ton_above_usd": {"type": "number", "minimum": 0},
              "per_amp_above_usd": {"type": "number", "minimum": 0}
            }
          }
        },
        "applies_to": {"type": "string"},
        "source_url": {"type": "string", "format": "uri"},
        "source_section": {"type": "string", "description": "Specific section/subsection of the source document (e.g. 'IO-04-63 Section I.B.3')"},
        "source_quality": {
          "type": "string",
          "enum": ["verified_official_data", "inferred_from_operational_consistency", "estimate_from_published_market_data", "estimate_from_anecdote"],
          "description": "Optional (v1.2). Quality marker for this specific permit fee value. Use when the value isn't directly verified against the current authoritative source document — e.g., 'inferred_from_operational_consistency' when the value comes from an older proposed/draft schedule whose fixed-fee amounts still match the current operational fee dictionary. Omission means the value is directly verified against the authoritative source identified in data_source_document."
        },
        "notes": {"type": "string"}
      },
      "oneOf": [
        {
          "properties": {"type": {"const": "flat"}},
          "required": ["fee_usd"]
        },
        {
          "properties": {"type": {"const": "flat_plus_surcharge"}},
          "required": ["base_usd"]
        },
        {
          "properties": {"type": {"const": "percentage_of_value"}},
          "required": ["rate"]
        },
        {
          "properties": {"type": {"const": "per_opening"}},
          "required": ["fee_usd_per_opening"]
        },
        {
          "properties": {"type": {"const": "per_square_foot"}},
          "required": ["fee_usd_per_sqft"]
        },
        {
          "properties": {"type": {"const": "per_ton_flat"}},
          "required": ["fee_usd_per_ton"]
        },
        {
          "properties": {"type": {"const": "per_amperage_unit"}},
          "required": ["fee_usd_per_amp_unit", "amp_unit_size"]
        },
        {
          "properties": {"type": {"const": "per_kw"}},
          "required": ["fee_usd_per_kw"]
        },
        {
          "properties": {"type": {"const": "per_1000_value"}},
          "required": ["fee_usd_per_1000_value"]
        },
        {
          "properties": {"type": {"const": "tiered_by_value"}},
          "required": ["tiers"]
        },
        {
          "properties": {"type": {"const": "tiered_by_tonnage"}},
          "required": ["tiers"]
        },
        {
          "properties": {"type": {"const": "tiered_by_amperage"}},
          "required": ["tiers"]
        }
      ]
    }
  }
}
