{
  "county": "palm-beach",
  "display_name": "Palm Beach County",
  "state": "FL",
  "metro_areas": [
    "West Palm Beach",
    "Boca Raton",
    "Boynton Beach",
    "Delray Beach",
    "Wellington",
    "Jupiter",
    "Lake Worth",
    "Royal Palm Beach",
    "Greenacres",
    "Palm Beach Gardens",
    "Riviera Beach",
    "Belle Glade",
    "Loxahatchee",
    "Pahokee",
    "Tequesta"
  ],
  "hvhz": false,
  "design_wind_speed_mph": {
    "risk_category_ii": 170,
    "risk_category_iii": 180,
    "risk_category_iv": 195
  },
  "data_source_url": "https://discover.pbcgov.org/pzb/PDF/Fees.pdf",
  "data_source_document": "Palm Beach County Planning, Zoning and Building Department fee dictionary (PDF generated 2026-03-02, 27 pages). Underlying authority: PBC Code of Ordinances Chapter 7 § 7-50 (Building) and the 'Proposed Permit Fee Adjustments — Exhibit A' document (Revised 08-04-09), the latter still operationally in force as evidenced by fixed-fee continuity (e.g., AC change-out $100, shutters $150/20 openings, residential fence $125, pool-barrier-in-yard $150 all appear verbatim in both the 2009 and 2026 schedules).",
  "last_verified": "2026-06-16",
  "schema_version": "1.2",
  "permits": {
    "building_permit_by_valuation": {
      "type": "tiered_by_value",
      "tiers": [
        {"max_value_usd": 2000, "fee_usd": 75},
        {"max_value_usd": 10000, "fee_usd_per_100": 2.50},
        {"max_value_usd": 100000, "fee_usd_per_100": 1.75},
        {"max_value_usd": 300000, "fee_usd_per_100": 1.00},
        {"max_value_usd": null, "fee_usd_per_100": 0.75}
      ],
      "minimum_usd": 75,
      "applies_to": "Default 'By Value' valuation formula used across most PBC permit categories (structural, electrical, mechanical, plumbing, roofing reroofs, additions, alterations, residential renovations, pools, generators >1-2 family, and dozens of additional categories shown in the 2026-03-02 fee dictionary as 'By Value ($75 Minimum)'). Excludes the fixed-fee categories explicitly listed below, which override the valuation formula.",
      "source_section": "PBC Proposed Permit Fee Adjustments (Revised 08-04-09) Exhibit A § I.A — Base Permit Fees",
      "source_quality": "inferred_from_operational_consistency",
      "notes": "PROGRESSIVE 5-tier formula (NOT full-bracket): a $50,000 permit pays $75 (first $2,000) + 2.50% on $2,001-$10,000 ($200) + 1.75% on $10,001-$50,000 ($700) = $975. Marked 'inferred_from_operational_consistency' because the formula is published only in the 2009 'Proposed Permit Fee Adjustments' document (Exhibit A § I.A) — the 2026-03-02 operational fee dictionary lists hundreds of permit categories with the wording 'By Value ($75 Minimum)' which presupposes a published valuation formula, and the 2009 document is the only such formula PBC has published. The $75 minimum from Tier 1 appears verbatim in essentially every By-Value entry in the 2026 dictionary, and several 2009 fixed-fee values (AC change-out $100, shutter $150/20 openings, residential fence $125, pool-barrier-in-yard $150) appear verbatim in the 2026 dictionary. This continuity establishes operational consistency, supporting the inference that the 2009 progressive valuation formula is administratively in force in 2026 even though direct verification against PBC Code Ch 7 § 7-50 was blocked by Municode's Angular SPA (which JS-blocks scraping). Schema-level note: the schema's `tiered_by_value` type doesn't currently distinguish progressive vs full-bracket application — that distinction is captured here in notes and is an A1.5 validator-script concern for writer-v2."
    },
    "ac_change_out_residential": {
      "type": "flat",
      "fee_usd": 100,
      "applies_to": "Like-for-like residential air-conditioning equipment change-out within a single dwelling unit. Per unit.",
      "source_section": "PBC Fee Dictionary 2026-03-02 p10 ('HVAC - Exact C/O - Res - W/In Single Unit (Like for Like)')",
      "source_quality": "verified_official_data",
      "notes": "Same $100 amount as 2009 Exhibit A § II.A.1 — fee unchanged for 17 years. Hard-wired condensers or work outside the like-for-like envelope fall under either the prepaid-permit program (II.E.2.b) or general HVAC valuation."
    },
    "ac_change_out_commercial_per_10_units": {
      "type": "flat",
      "fee_usd": 150,
      "applies_to": "Commercial or multi-residential common-area HVAC equipment change-out, billed per 10 units (or fraction thereof).",
      "source_section": "PBC Fee Dictionary 2026-03-02 p10 ('HVAC - Eqpmt C/O - Comm/Common Multi-Res')",
      "source_quality": "verified_official_data"
    },
    "shutters_per_20_openings": {
      "type": "flat",
      "fee_usd": 150,
      "applies_to": "Hurricane shutter installation, billed per 20 openings or fraction thereof (NOT per single opening).",
      "source_section": "PBC Fee Dictionary 2026-03-02 p17 ('Shutter $150 Per 20 Openings')",
      "source_quality": "verified_official_data",
      "notes": "Fee is per 20-opening increment, not per single opening. A typical SFD installation of 12-18 openings = $150 (1 increment). A larger home with 30 openings = $300 (2 increments). Same $150 amount as 2009 Exhibit A § II.I.3 — unchanged."
    },
    "windows_doors_per_20_openings_no_shutters": {
      "type": "flat",
      "fee_usd": 100,
      "applies_to": "Window and/or entry door replacement, per 20 openings or fraction thereof, when shutters are NOT also installed.",
      "source_section": "PBC Proposed Permit Fee Adjustments (Revised 08-04-09) Exhibit A § II.I.1",
      "source_quality": "inferred_from_operational_consistency",
      "notes": "From 2009 Exhibit A; the 2026 dictionary lists window/door replacements as 'By Value ($75 Minimum)' alongside per-20-opening pricing for shutters specifically, suggesting per-opening billing remains an available option for window-only jobs. If only the By-Value path is in current use, this entry should be reclassified — flag for A1.5 verification."
    },
    "windows_doors_with_shutters_per_20_openings": {
      "type": "flat",
      "fee_usd": 200,
      "applies_to": "Window and/or entry door replacement WITH shutters, per 20 openings or fraction thereof.",
      "source_section": "PBC Proposed Permit Fee Adjustments (Revised 08-04-09) Exhibit A § II.I.2",
      "source_quality": "inferred_from_operational_consistency"
    },
    "garage_door_per_3_openings": {
      "type": "flat",
      "fee_usd": 100,
      "applies_to": "Garage door replacement, per 3 openings or fraction thereof.",
      "source_section": "PBC Proposed Permit Fee Adjustments (Revised 08-04-09) Exhibit A § II.I.4",
      "source_quality": "inferred_from_operational_consistency"
    },
    "fence_residential": {
      "type": "flat",
      "fee_usd": 125,
      "applies_to": "Residential perimeter fence, with required inspection. Per permit.",
      "source_section": "PBC Fee Dictionary 2026-03-02 p8 ('Fence - Residential $125 Each')",
      "source_quality": "verified_official_data",
      "notes": "$75 alternative tier exists in 2009 Exhibit A § II.L.1 for 'no-inspection' residential fences; current 2026 dictionary lists the inspected $125 amount as the standard residential rate."
    },
    "fence_commercial_per_500_lf": {
      "type": "flat",
      "fee_usd": 100,
      "applies_to": "Commercial fence, billed per 500 linear feet or fraction thereof, with required inspection.",
      "source_section": "PBC Fee Dictionary 2026-03-02 p8 ('Fence - Commercial $100 Per 500 Liner Foot')",
      "source_quality": "verified_official_data"
    },
    "pool_barrier_in_yard": {
      "type": "flat",
      "fee_usd": 150,
      "applies_to": "New in-yard pool barrier (fence or wall around pool perimeter), with plan review and inspection. Florida requires a pool barrier per FS 515.27 — typically required as part of a pool permit, or as a standalone permit when retrofitting an existing pool.",
      "source_section": "PBC Fee Dictionary 2026-03-02 p8 ('Fence - Pool Barrier - In Yard $150 Each')",
      "source_quality": "verified_official_data"
    },
    "pool_barrier_on_deck": {
      "type": "flat",
      "fee_usd": 100,
      "applies_to": "New on-deck pool barrier (railing or partial enclosure on pool deck), with plan review and inspection.",
      "source_section": "PBC Fee Dictionary 2026-03-02 p8 ('Fence - Pool Barrier - New On Deck $100 Each')",
      "source_quality": "verified_official_data"
    },
    "pool_screen_enclosure": {
      "type": "flat",
      "fee_usd": 200,
      "applies_to": "Pool screen enclosure (cage). Sub-permit fee when added to a primary pool permit.",
      "source_section": "PBC Fee Dictionary 2026-03-02 p14 ('Pool Barrier Screen Enclosure (Sub) $200 Each')",
      "source_quality": "verified_official_data"
    },
    "roofing_flat_small": {
      "type": "flat",
      "fee_usd": 150,
      "applies_to": "Flat roof installation under 4 squares (400 sq ft) on 1 & 2 family dwellings, pre-approved roof systems only, under the prepay permit program.",
      "source_section": "PBC Fee Dictionary 2026-03-02 p16 ('Roofing Flat (less than 4 squares) $150 Each')",
      "source_quality": "verified_official_data",
      "notes": "Larger or non-pre-approved flat roofs fall under the general reroofing By-Value formula."
    },
    "roofing_repair_minor": {
      "type": "flat",
      "fee_usd": 75,
      "applies_to": "Roof repair under 2 squares (200 sq ft) AND under $2,500 value.",
      "source_section": "PBC Fee Dictionary 2026-03-02 p17 ('Roofing Repair (Under 2 Squares Or $2500 Value) $75 Each')",
      "source_quality": "verified_official_data"
    },
    "roofing_penetrations_pre_approved": {
      "type": "flat",
      "fee_usd": 75,
      "applies_to": "Roof penetrations, vents, skylights — installed under a Master Plan or with Product Approval (no individual plan review).",